{
  "format": "test-parrot/exam",
  "formatVersion": "0.2.0",
  "name": "Unit 3 Quiz",
  "header": {
    "differentFirstPage": true,
    "first": {
      "type": "document",
      "content": [
        {
          "type": "paragraph",
          "content": [
            {
              "type": "text",
              "text": "Springfield High School",
              "marks": [
                {
                  "type": "strong"
                }
              ]
            }
          ]
        },
        {
          "type": "table",
          "content": [
            {
              "type": "table-row",
              "header": true,
              "content": [
                {
                  "type": "table-cell",
                  "header": true,
                  "content": [
                    {
                      "type": "paragraph",
                      "content": [
                        {
                          "type": "text",
                          "text": "Name: ____________"
                        }
                      ]
                    }
                  ]
                },
                {
                  "type": "table-cell",
                  "header": true,
                  "content": [
                    {
                      "type": "paragraph",
                      "content": [
                        {
                          "type": "exam-id"
                        }
                      ]
                    }
                  ]
                }
              ]
            }
          ]
        }
      ]
    },
    "later": {
      "type": "document",
      "content": [
        {
          "type": "paragraph",
          "content": [
            {
              "type": "text",
              "text": "Chemistry — "
            },
            {
              "type": "exam-id"
            }
          ]
        }
      ]
    }
  },
  "positions": [
    {
      "question": {
        "bank": "bank",
        "question": "q1"
      }
    }
  ]
}
